V14A1,Cantidad de baños de la vivienda,1
V14B,Exclusividad del uso del baño en la vivienda,1
V15,Electricidad de la vivienda,1
V16,Fuente de energía para cocinar en la vivienda,1
V17A,Sistema de eliminación de basura en la vivienda,1
V17B1,¿Separan la basura orgánica?,0
V17B2,¿Separan la basura plástica?,0
V17B3,¿Separan la basura de vidrio?,0
V17B4,¿Separan la basura de aluminio?,0
V17B5,¿Separan la basura de papel o cartón?,0
V17B6,¿Separan otro tipo de basura?,0
V18A,Tenencia de teléfono celular,1
V18A1,Cantidad de teléfonos celulares,0
V18B,Tenencia de teléfono residencial,1
V18B1,Cantidad de teléfonos residenciales,0
V18C,Tenencia de refrigeradora,1
V18D,Tenencia de sistema de agua caliente para toda la casa,1
V18E,Tenencia de tanque para almacenar agua,1
V18F,Tenencia de computadora portátil,1
V18F1,Cantidad de computadoras portátiles,0
V18G,Tenencia de computadora de escritorio,1
V18G1,Cantidad de computadoras de escritorio,0
V18H,Tenencia de fax (no de computadora),0
V18I,Tenencia de radio o equipo de sonido,1
V18I1,Cantidad de radios,0
V18J,Tenencia de automóvil (no de trabajo),1
V18J1,Cantidad de Automoviles,0
V18K,Tenencia de moto (no de trabajo),1
V18K1,Cantidad de motos,0
V18L,"Tenencia de TV de plasma, LCD o LED",1
V18L1,"Cantidad de TV de plasma, LCD o LED",0
V18L2,Cantidad de Smart TV,0
V18M,Tenencia de TV convencional,1
V18M1,Cantidad de TV convencional,0
V18O,Tenencia de servicio de televisión paga por cable,1
V18P,Tenencia de servicio de televisión paga por satélite,1
V18Q,Tenencia de tableta,1
V18Q1,Cantidad de tabletas,0
V18R,Otro tipo de servicio de televisión paga,1
V18S,Tenencia de servicio de televisión paga por IPTV,1
V19,Tenencia de Internet,1
V19B,Tipo de conexión al servicio de internet,1
V19D,Principal razón para no tener servicio de internet,0
V21,Este hogar recibió bono de vivienda,1
V21A,¿En que año recibió el bono de vivienda?,1
V21B,Tipo de bono de vivienda recibido,1
V2A,Tipo de tenencia de la vivienda,1
V2A1,Mensualidad pagada por la vivienda,1
V2B,Mensualidad que pagaría si tuviera que alquilar,0
V3,Material de las paredes exteriores de la vivienda,1
V4,Material del techo de la vivienda,1
V5,¿La vivienda tiene cielo raso?,1
V6,Material del piso de la vivienda,1
V6A,¿La vivienda se encuentra sobre pilotes?,1
V7A,Estado de las paredes exteriores de la vivienda,1
V7B,Estado del techo de la vivienda,1
V7C,Estado del piso de la vivienda,1
V8,Cantidad de cuartos para dormir de la vivienda,1
V9,Total de aposentos de la vivienda,1
ZONA,Zona,1
